{
  "schema_version": 2,
  "evidence_id": "EVD-034",
  "retrieved": "2026-07-29",
  "url": "https://atlassian.design/foundations/content/voice-tone/",
  "locator": "Voice and tone; How to apply Atlassian's personality traits; Voice and tone principles",
  "content_kind": "maintainer_summary",
  "summary": "Atlassian distinguishes a consistent brand voice from tone that changes with the user's situation, recommends balancing voice traits for audience and emotional state, and calls for recognizable vocabulary and experience across interfaces, websites, and communications."
}
