{
  "schema_version": 2,
  "evidence_id": "EVD-045",
  "retrieved": "2026-08-02",
  "url": "https://www.youtube.com/watch?v=zKBUBVtoM0g",
  "locator": "Official description and chapter list; auto-generated transcript 00:01-05:14, 07:08-15:45; sampled frames 02:17, 02:50, 07:27, 09:09, 09:45",
  "content_kind": "maintainer_summary",
  "summary": "The practitioner says cards are not a design sin, compares card and flatter hierarchies, questions exposing every action, and explores borders, tabs, subheadings, design-before-implementation, varied outputs, and component defaults. The examples support contextual alternatives and refinement, not prohibited ingredients or a required concept count."
}
