{
  "schema_version": 2,
  "evidence_id": "EVD-031",
  "retrieved": "2026-08-02",
  "url": "https://help.figma.com/hc/en-us/articles/31304412302231-Explore-Figma-Make",
  "locator": "What is Figma Make?; Bring your design to Figma Make; Copy a Figma Make preview as design layers; Create and publish a Make kit",
  "content_kind": "maintainer_summary",
  "summary": "Figma documents functional previews, exploration of multiple solutions, attachment of existing designs for context, iterative edits, reusable design-system context, and copying preview snapshots into design layers for comparison and editing. These capabilities support contextual exploration, but the documentation does not prescribe a universal number of hypotheses, proofs, or rendered alternatives."
}
