{
  "schema_version": 2,
  "evidence_id": "EVD-001",
  "retrieved": "2026-08-02",
  "url": "https://arxiv.org/html/2603.13036v1",
  "locator": "Sections 3.1-3.2, 4.2.5, 5.1-5.4, and 7",
  "content_kind": "maintainer_summary",
  "summary": "Shin et al. analyze academic and grey literature plus six tool walkthroughs, argue frictionless generation can encourage acceptance of probabilistic defaults, and propose reflective negotiation and contextual anchoring. Their named minimalist example is context-specific, not a style ban. They acknowledge limited evidence about real-world creators and call for empirical follow-up."
}
