{
  "schema_version": 2,
  "evidence_id": "EVD-053",
  "retrieved": "2026-08-23",
  "url": "https://github.com/pbakaus/impeccable/tree/56f44523f76efdcec813e67b38ee550e49b16f48",
  "locator": "Apache-2.0 repository; detector registry and antipattern fixtures at commit 56f44523f76efdcec813e67b38ee550e49b16f48",
  "content_kind": "maintainer_summary",
  "summary": "Impeccable includes executable detectors and fixtures for hero eyebrows, kickers above headings, numbered section labels, and repeated container text. Design DNA adapts exact relationship evidence as non-gating review candidates, but rejects Impeccable's claim that a kicker is automatically defective or proof of AI authorship."
}
