{
  "schema_version": 2,
  "evidence_id": "EVD-044",
  "retrieved": "2026-08-02",
  "url": "https://www.youtube.com/watch?v=RynySryqM_0",
  "locator": "Official description; auto-generated transcript 01:05-09:41, 14:15-26:31, 30:06-35:17; sampled frames 10:41, 21:21, 32:02",
  "content_kind": "maintainer_summary",
  "summary": "Reviewers describe motion as helpful or distracting by context. Across sampled startup sites, template resemblance is accompanied by naming confusion, competing actions, clipped media, missing detail, mismatched UI, unclear waiting states, errors, and unexplained controls. They praise clear messaging and an accessible demo despite other imperfections."
}
