{
  "schema_version": 2,
  "evidence_id": "EVD-022",
  "retrieved": "2026-07-26",
  "url": "https://www.framer.com/help/articles/how-are-fonts-optimized-in-framer/",
  "locator": "Kinds of fonts and FAQ",
  "content_kind": "verbatim_excerpt",
  "excerpt": "Framer font alternatives: Inter and Inter Display fonts, used as default fonts for new text blocks."
}
